Name: “Table 1 of 1 on page 13 of 88”,Name: “Table 1 of 1 on page 13 of 88”,Name: “Table 1 of 1 on page 13 of 88”,Name: “Table 1 of 1 on page 13 of 88”,Name: “Table 1 of 1 on page 13 of 88”,Name: “Table 1 of 1 on page 13 of 88”,Name: “Table 1 of 1 on page 13 of 88”,Name: “Table 1 of 1 on page 13 of 88”,Name: “Table 1 of 1 on page 13 of 88”,Name: “Table 1 of 1 on page 13 of 88”,Name: “Table 1 of 1 on page 13 of 88”,Name: “Table 1 of 1 on page 13 of 88”,Name: “Table 1 of 1 on page 13 of 88”,Name: “Table 1 of 1 on page 13 of 88”,Name: “Table 1 of 1 on page 13 of 88”
Table: 13,Table: 13,Table: 13,Table: 13,Table: 13,Table: 13,Table: 13,Table: 13,Table: 13,Table: 13,Table: 13,Table: 13,Table: 13,Table: 13,Table: 13
,,,,,,,,,,,,,,
,,,,,,,,,,,Toll Feasibility Study,Toll Feasibility Study,Toll Feasibility Study,Toll Feasibility Study
"congestion; if tolls are too high, travel demand for these roadways will be relatively low","congestion; if tolls are too high, travel demand for these roadways will be relatively low","congestion; if tolls are too high, travel demand for these roadways will be relatively low","congestion; if tolls are too high, travel demand for these roadways will be relatively low","congestion; if tolls are too high, travel demand for these roadways will be relatively low","congestion; if tolls are too high, travel demand for these roadways will be relatively low","congestion; if tolls are too high, travel demand for these roadways will be relatively low","congestion; if tolls are too high, travel demand for these roadways will be relatively low","congestion; if tolls are too high, travel demand for these roadways will be relatively low","congestion; if tolls are too high, travel demand for these roadways will be relatively low","congestion; if tolls are too high, travel demand for these roadways will be relatively low","congestion; if tolls are too high, travel demand for these roadways will be relatively low","congestion; if tolls are too high, travel demand for these roadways will be relatively low","congestion; if tolls are too high, travel demand for these roadways will be relatively low","congestion; if tolls are too high, travel demand for these roadways will be relatively low"
leaving,a,significant,amount,of,excess,,capacity.,capacity.,The,improvements,improvements,the,tolls,are
financing will therefore not sufficiently benefit the traveling public.,financing will therefore not sufficiently benefit the traveling public.,financing will therefore not sufficiently benefit the traveling public.,financing will therefore not sufficiently benefit the traveling public.,financing will therefore not sufficiently benefit the traveling public.,financing will therefore not sufficiently benefit the traveling public.,financing will therefore not sufficiently benefit the traveling public.,financing will therefore not sufficiently benefit the traveling public.,financing will therefore not sufficiently benefit the traveling public.,financing will therefore not sufficiently benefit the traveling public.,financing will therefore not sufficiently benefit the traveling public.,Tolls may also cause,Tolls may also cause,Tolls may also cause,Tolls may also cause
travelers to deviate from tolled routes creating congestion problems on roadways that,travelers to deviate from tolled routes creating congestion problems on roadways that,travelers to deviate from tolled routes creating congestion problems on roadways that,travelers to deviate from tolled routes creating congestion problems on roadways that,travelers to deviate from tolled routes creating congestion problems on roadways that,travelers to deviate from tolled routes creating congestion problems on roadways that,travelers to deviate from tolled routes creating congestion problems on roadways that,travelers to deviate from tolled routes creating congestion problems on roadways that,travelers to deviate from tolled routes creating congestion problems on roadways that,travelers to deviate from tolled routes creating congestion problems on roadways that,travelers to deviate from tolled routes creating congestion problems on roadways that,travelers to deviate from tolled routes creating congestion problems on roadways that,travelers to deviate from tolled routes creating congestion problems on roadways that,travelers to deviate from tolled routes creating congestion problems on roadways that,travelers to deviate from tolled routes creating congestion problems on roadways that
are part of competing routes.,are part of competing routes.,are part of competing routes.,are part of competing routes.,These effects can impact existing transportation plans,These effects can impact existing transportation plans,These effects can impact existing transportation plans,These effects can impact existing transportation plans,These effects can impact existing transportation plans,These effects can impact existing transportation plans,These effects can impact existing transportation plans,These effects can impact existing transportation plans,These effects can impact existing transportation plans,These effects can impact existing transportation plans,These effects can impact existing transportation plans
and planning activities associated with other projects.,and planning activities associated with other projects.,and planning activities associated with other projects.,and planning activities associated with other projects.,and planning activities associated with other projects.,and planning activities associated with other projects.,and planning activities associated with other projects.,and planning activities associated with other projects.,and planning activities associated with other projects.,and planning activities associated with other projects.,,,,,
"Specifically, this study intended to examine changes in","Specifically, this study intended to examine changes in","Specifically, this study intended to examine changes in","Specifically, this study intended to examine changes in","Specifically, this study intended to examine changes in","Specifically, this study intended to examine changes in","Specifically, this study intended to examine changes in","Specifically, this study intended to examine changes in","Specifically, this study intended to examine changes in","Specifically, this study intended to examine changes in",roadway level-of-service and,roadway level-of-service and,roadway level-of-service and,roadway level-of-service and,roadway level-of-service and
travel,patterns,associated,associated,with,tolling,of,projects,projects,subject,to,financial,analysis,in,the
previous section.,previous section.,previous section.,"However, it is important to remember that this study analyzed project","However, it is important to remember that this study analyzed project","However, it is important to remember that this study analyzed project","However, it is important to remember that this study analyzed project","However, it is important to remember that this study analyzed project","However, it is important to remember that this study analyzed project","However, it is important to remember that this study analyzed project","However, it is important to remember that this study analyzed project","However, it is important to remember that this study analyzed project","However, it is important to remember that this study analyzed project","However, it is important to remember that this study analyzed project","However, it is important to remember that this study analyzed project"
financial feasibility under conditions that maximize revenue and in many instances this,financial feasibility under conditions that maximize revenue and in many instances this,financial feasibility under conditions that maximize revenue and in many instances this,financial feasibility under conditions that maximize revenue and in many instances this,financial feasibility under conditions that maximize revenue and in many instances this,financial feasibility under conditions that maximize revenue and in many instances this,financial feasibility under conditions that maximize revenue and in many instances this,financial feasibility under conditions that maximize revenue and in many instances this,financial feasibility under conditions that maximize revenue and in many instances this,financial feasibility under conditions that maximize revenue and in many instances this,financial feasibility under conditions that maximize revenue and in many instances this,financial feasibility under conditions that maximize revenue and in many instances this,financial feasibility under conditions that maximize revenue and in many instances this,financial feasibility under conditions that maximize revenue and in many instances this,financial feasibility under conditions that maximize revenue and in many instances this
assumption resulted in toll values that significantly reduced travel demand on project,assumption resulted in toll values that significantly reduced travel demand on project,assumption resulted in toll values that significantly reduced travel demand on project,assumption resulted in toll values that significantly reduced travel demand on project,assumption resulted in toll values that significantly reduced travel demand on project,assumption resulted in toll values that significantly reduced travel demand on project,assumption resulted in toll values that significantly reduced travel demand on project,assumption resulted in toll values that significantly reduced travel demand on project,assumption resulted in toll values that significantly reduced travel demand on project,assumption resulted in toll values that significantly reduced travel demand on project,assumption resulted in toll values that significantly reduced travel demand on project,assumption resulted in toll values that significantly reduced travel demand on project,assumption resulted in toll values that significantly reduced travel demand on project,assumption resulted in toll values that significantly reduced travel demand on project,assumption resulted in toll values that significantly reduced travel demand on project
roadways.,roadways.,The,travel,impact,analysis,,in,this,study,can,"provide,","however,",useful,useful
qualitative information regarding the impact of the tolls and projects on travel demand.,qualitative information regarding the impact of the tolls and projects on travel demand.,qualitative information regarding the impact of the tolls and projects on travel demand.,qualitative information regarding the impact of the tolls and projects on travel demand.,qualitative information regarding the impact of the tolls and projects on travel demand.,qualitative information regarding the impact of the tolls and projects on travel demand.,qualitative information regarding the impact of the tolls and projects on travel demand.,qualitative information regarding the impact of the tolls and projects on travel demand.,qualitative information regarding the impact of the tolls and projects on travel demand.,qualitative information regarding the impact of the tolls and projects on travel demand.,qualitative information regarding the impact of the tolls and projects on travel demand.,qualitative information regarding the impact of the tolls and projects on travel demand.,qualitative information regarding the impact of the tolls and projects on travel demand.,qualitative information regarding the impact of the tolls and projects on travel demand.,qualitative information regarding the impact of the tolls and projects on travel demand.
Travel demand impacts are discussed more extensively in Chapter 4.,Travel demand impacts are discussed more extensively in Chapter 4.,Travel demand impacts are discussed more extensively in Chapter 4.,Travel demand impacts are discussed more extensively in Chapter 4.,Travel demand impacts are discussed more extensively in Chapter 4.,Travel demand impacts are discussed more extensively in Chapter 4.,Travel demand impacts are discussed more extensively in Chapter 4.,Travel demand impacts are discussed more extensively in Chapter 4.,Travel demand impacts are discussed more extensively in Chapter 4.,Travel demand impacts are discussed more extensively in Chapter 4.,Travel demand impacts are discussed more extensively in Chapter 4.,Travel demand impacts are discussed more extensively in Chapter 4.,,,
,,,,,,,,,,,,,,1-8
