Name: “Table 1 of 1 on page 58 of 80”,Name: “Table 1 of 1 on page 58 of 80”,Name: “Table 1 of 1 on page 58 of 80”,Name: “Table 1 of 1 on page 58 of 80”,Name: “Table 1 of 1 on page 58 of 80”,Name: “Table 1 of 1 on page 58 of 80”,Name: “Table 1 of 1 on page 58 of 80”,Name: “Table 1 of 1 on page 58 of 80”,Name: “Table 1 of 1 on page 58 of 80”,Name: “Table 1 of 1 on page 58 of 80”,Name: “Table 1 of 1 on page 58 of 80”,Name: “Table 1 of 1 on page 58 of 80”,Name: “Table 1 of 1 on page 58 of 80”,Name: “Table 1 of 1 on page 58 of 80”,Name: “Table 1 of 1 on page 58 of 80”,Name: “Table 1 of 1 on page 58 of 80”
Table: 56,Table: 56,Table: 56,Table: 56,Table: 56,Table: 56,Table: 56,Table: 56,Table: 56,Table: 56,Table: 56,Table: 56,Table: 56,Table: 56,Table: 56,Table: 56
,,,,,,,,,,,,,,,
,,,,,,,,TA B 2 :,P ROJ E CT CHA RA CT ERI S TI CS,P ROJ E CT CHA RA CT ERI S TI CS,P ROJ E CT CHA RA CT ERI S TI CS,P ROJ E CT CHA RA CT ERI S TI CS,P ROJ E CT CHA RA CT ERI S TI CS,P ROJ E CT CHA RA CT ERI S TI CS,
,,,,,,,,,,,2 . e,Cr i t ic a l Suc c e s s Fa c t o r s,Cr i t ic a l Suc c e s s Fa c t o r s,Cr i t ic a l Suc c e s s Fa c t o r s,
"a dedicated sales tax increment, a dedicated gas tax increment, or a combination of these financing","a dedicated sales tax increment, a dedicated gas tax increment, or a combination of these financing","a dedicated sales tax increment, a dedicated gas tax increment, or a combination of these financing","a dedicated sales tax increment, a dedicated gas tax increment, or a combination of these financing","a dedicated sales tax increment, a dedicated gas tax increment, or a combination of these financing","a dedicated sales tax increment, a dedicated gas tax increment, or a combination of these financing","a dedicated sales tax increment, a dedicated gas tax increment, or a combination of these financing","a dedicated sales tax increment, a dedicated gas tax increment, or a combination of these financing","a dedicated sales tax increment, a dedicated gas tax increment, or a combination of these financing","a dedicated sales tax increment, a dedicated gas tax increment, or a combination of these financing","a dedicated sales tax increment, a dedicated gas tax increment, or a combination of these financing","a dedicated sales tax increment, a dedicated gas tax increment, or a combination of these financing","a dedicated sales tax increment, a dedicated gas tax increment, or a combination of these financing","a dedicated sales tax increment, a dedicated gas tax increment, or a combination of these financing","a dedicated sales tax increment, a dedicated gas tax increment, or a combination of these financing",
alternatives. The November 2002 referendum provided mixed results on similar questions but there,alternatives. The November 2002 referendum provided mixed results on similar questions but there,alternatives. The November 2002 referendum provided mixed results on similar questions but there,alternatives. The November 2002 referendum provided mixed results on similar questions but there,alternatives. The November 2002 referendum provided mixed results on similar questions but there,alternatives. The November 2002 referendum provided mixed results on similar questions but there,alternatives. The November 2002 referendum provided mixed results on similar questions but there,alternatives. The November 2002 referendum provided mixed results on similar questions but there,alternatives. The November 2002 referendum provided mixed results on similar questions but there,alternatives. The November 2002 referendum provided mixed results on similar questions but there,alternatives. The November 2002 referendum provided mixed results on similar questions but there,alternatives. The November 2002 referendum provided mixed results on similar questions but there,alternatives. The November 2002 referendum provided mixed results on similar questions but there,alternatives. The November 2002 referendum provided mixed results on similar questions but there,alternatives. The November 2002 referendum provided mixed results on similar questions but there,
remains strong support for a viable Third Hampton Roads Crossing. Gaining additional public support,remains strong support for a viable Third Hampton Roads Crossing. Gaining additional public support,remains strong support for a viable Third Hampton Roads Crossing. Gaining additional public support,remains strong support for a viable Third Hampton Roads Crossing. Gaining additional public support,remains strong support for a viable Third Hampton Roads Crossing. Gaining additional public support,remains strong support for a viable Third Hampton Roads Crossing. Gaining additional public support,remains strong support for a viable Third Hampton Roads Crossing. Gaining additional public support,remains strong support for a viable Third Hampton Roads Crossing. Gaining additional public support,remains strong support for a viable Third Hampton Roads Crossing. Gaining additional public support,remains strong support for a viable Third Hampton Roads Crossing. Gaining additional public support,remains strong support for a viable Third Hampton Roads Crossing. Gaining additional public support,remains strong support for a viable Third Hampton Roads Crossing. Gaining additional public support,remains strong support for a viable Third Hampton Roads Crossing. Gaining additional public support,remains strong support for a viable Third Hampton Roads Crossing. Gaining additional public support,remains strong support for a viable Third Hampton Roads Crossing. Gaining additional public support,
"for financing the project during the next six years is critical, otherwise the project’s cost could nearly","for financing the project during the next six years is critical, otherwise the project’s cost could nearly","for financing the project during the next six years is critical, otherwise the project’s cost could nearly","for financing the project during the next six years is critical, otherwise the project’s cost could nearly","for financing the project during the next six years is critical, otherwise the project’s cost could nearly","for financing the project during the next six years is critical, otherwise the project’s cost could nearly","for financing the project during the next six years is critical, otherwise the project’s cost could nearly","for financing the project during the next six years is critical, otherwise the project’s cost could nearly","for financing the project during the next six years is critical, otherwise the project’s cost could nearly","for financing the project during the next six years is critical, otherwise the project’s cost could nearly","for financing the project during the next six years is critical, otherwise the project’s cost could nearly","for financing the project during the next six years is critical, otherwise the project’s cost could nearly","for financing the project during the next six years is critical, otherwise the project’s cost could nearly","for financing the project during the next six years is critical, otherwise the project’s cost could nearly","for financing the project during the next six years is critical, otherwise the project’s cost could nearly",
double without any tangible benefit to the public. TAB 3 discusses SWB’s proposed financial plan.,double without any tangible benefit to the public. TAB 3 discusses SWB’s proposed financial plan.,double without any tangible benefit to the public. TAB 3 discusses SWB’s proposed financial plan.,double without any tangible benefit to the public. TAB 3 discusses SWB’s proposed financial plan.,double without any tangible benefit to the public. TAB 3 discusses SWB’s proposed financial plan.,double without any tangible benefit to the public. TAB 3 discusses SWB’s proposed financial plan.,double without any tangible benefit to the public. TAB 3 discusses SWB’s proposed financial plan.,double without any tangible benefit to the public. TAB 3 discusses SWB’s proposed financial plan.,double without any tangible benefit to the public. TAB 3 discusses SWB’s proposed financial plan.,double without any tangible benefit to the public. TAB 3 discusses SWB’s proposed financial plan.,double without any tangible benefit to the public. TAB 3 discusses SWB’s proposed financial plan.,double without any tangible benefit to the public. TAB 3 discusses SWB’s proposed financial plan.,double without any tangible benefit to the public. TAB 3 discusses SWB’s proposed financial plan.,double without any tangible benefit to the public. TAB 3 discusses SWB’s proposed financial plan.,double without any tangible benefit to the public. TAB 3 discusses SWB’s proposed financial plan.,
` Forming,Coalitions,Coalitions,-,VDOT,and,the,SWB,Team,must,form,stakeholder,coalitions,during,during,the
development,process,to,develop,develop,mutually,mutually,beneficial,solutions,solutions,and,foster,communication.,The,major,
"participants will include the FHWA, the U.S. Army Corps of Engineers, the U.S. Navy, the Hampton","participants will include the FHWA, the U.S. Army Corps of Engineers, the U.S. Navy, the Hampton","participants will include the FHWA, the U.S. Army Corps of Engineers, the U.S. Navy, the Hampton","participants will include the FHWA, the U.S. Army Corps of Engineers, the U.S. Navy, the Hampton","participants will include the FHWA, the U.S. Army Corps of Engineers, the U.S. Navy, the Hampton","participants will include the FHWA, the U.S. Army Corps of Engineers, the U.S. Navy, the Hampton","participants will include the FHWA, the U.S. Army Corps of Engineers, the U.S. Navy, the Hampton","participants will include the FHWA, the U.S. Army Corps of Engineers, the U.S. Navy, the Hampton","participants will include the FHWA, the U.S. Army Corps of Engineers, the U.S. Navy, the Hampton","participants will include the FHWA, the U.S. Army Corps of Engineers, the U.S. Navy, the Hampton","participants will include the FHWA, the U.S. Army Corps of Engineers, the U.S. Navy, the Hampton","participants will include the FHWA, the U.S. Army Corps of Engineers, the U.S. Navy, the Hampton","participants will include the FHWA, the U.S. Army Corps of Engineers, the U.S. Navy, the Hampton","participants will include the FHWA, the U.S. Army Corps of Engineers, the U.S. Navy, the Hampton","participants will include the FHWA, the U.S. Army Corps of Engineers, the U.S. Navy, the Hampton",
Roads,Metropolitan,Planning,Planning,"Organization,","Organization,","Organization,",local,"jurisdictions,","jurisdictions,",and,other,local,agencies,and,port
"authorities, as well as business interests and the public at large. Defining mutual interests and developing","authorities, as well as business interests and the public at large. Defining mutual interests and developing","authorities, as well as business interests and the public at large. Defining mutual interests and developing","authorities, as well as business interests and the public at large. Defining mutual interests and developing","authorities, as well as business interests and the public at large. Defining mutual interests and developing","authorities, as well as business interests and the public at large. Defining mutual interests and developing","authorities, as well as business interests and the public at large. Defining mutual interests and developing","authorities, as well as business interests and the public at large. Defining mutual interests and developing","authorities, as well as business interests and the public at large. Defining mutual interests and developing","authorities, as well as business interests and the public at large. Defining mutual interests and developing","authorities, as well as business interests and the public at large. Defining mutual interests and developing","authorities, as well as business interests and the public at large. Defining mutual interests and developing","authorities, as well as business interests and the public at large. Defining mutual interests and developing","authorities, as well as business interests and the public at large. Defining mutual interests and developing","authorities, as well as business interests and the public at large. Defining mutual interests and developing",
plans to address those interests will be of paramount importance. SWB has dealt effectively with all of the,plans to address those interests will be of paramount importance. SWB has dealt effectively with all of the,plans to address those interests will be of paramount importance. SWB has dealt effectively with all of the,plans to address those interests will be of paramount importance. SWB has dealt effectively with all of the,plans to address those interests will be of paramount importance. SWB has dealt effectively with all of the,plans to address those interests will be of paramount importance. SWB has dealt effectively with all of the,plans to address those interests will be of paramount importance. SWB has dealt effectively with all of the,plans to address those interests will be of paramount importance. SWB has dealt effectively with all of the,plans to address those interests will be of paramount importance. SWB has dealt effectively with all of the,plans to address those interests will be of paramount importance. SWB has dealt effectively with all of the,plans to address those interests will be of paramount importance. SWB has dealt effectively with all of the,plans to address those interests will be of paramount importance. SWB has dealt effectively with all of the,plans to address those interests will be of paramount importance. SWB has dealt effectively with all of the,plans to address those interests will be of paramount importance. SWB has dealt effectively with all of the,plans to address those interests will be of paramount importance. SWB has dealt effectively with all of the,
involved parties in the past. Relationships already exist that will allow SWB to quickly move forward.,involved parties in the past. Relationships already exist that will allow SWB to quickly move forward.,involved parties in the past. Relationships already exist that will allow SWB to quickly move forward.,involved parties in the past. Relationships already exist that will allow SWB to quickly move forward.,involved parties in the past. Relationships already exist that will allow SWB to quickly move forward.,involved parties in the past. Relationships already exist that will allow SWB to quickly move forward.,involved parties in the past. Relationships already exist that will allow SWB to quickly move forward.,involved parties in the past. Relationships already exist that will allow SWB to quickly move forward.,involved parties in the past. Relationships already exist that will allow SWB to quickly move forward.,involved parties in the past. Relationships already exist that will allow SWB to quickly move forward.,involved parties in the past. Relationships already exist that will allow SWB to quickly move forward.,involved parties in the past. Relationships already exist that will allow SWB to quickly move forward.,involved parties in the past. Relationships already exist that will allow SWB to quickly move forward.,involved parties in the past. Relationships already exist that will allow SWB to quickly move forward.,involved parties in the past. Relationships already exist that will allow SWB to quickly move forward.,
THI4R8D HAMPTON ROADS CROSSING,THI4R8D HAMPTON ROADS CROSSING,THI4R8D HAMPTON ROADS CROSSING,THI4R8D HAMPTON ROADS CROSSING,,,,,,,,,,,,48
CONCEPTUAL PROPOSAL,CONCEPTUAL PROPOSAL,,,,,,,,,,,,,,
