Name: “Table 1 of 1 on page 8 of 80”,Name: “Table 1 of 1 on page 8 of 80”,Name: “Table 1 of 1 on page 8 of 80”,Name: “Table 1 of 1 on page 8 of 80”,Name: “Table 1 of 1 on page 8 of 80”,Name: “Table 1 of 1 on page 8 of 80”,Name: “Table 1 of 1 on page 8 of 80”,Name: “Table 1 of 1 on page 8 of 80”,Name: “Table 1 of 1 on page 8 of 80”,Name: “Table 1 of 1 on page 8 of 80”,Name: “Table 1 of 1 on page 8 of 80”,Name: “Table 1 of 1 on page 8 of 80”,Name: “Table 1 of 1 on page 8 of 80”,Name: “Table 1 of 1 on page 8 of 80”,Name: “Table 1 of 1 on page 8 of 80”,Name: “Table 1 of 1 on page 8 of 80”,Name: “Table 1 of 1 on page 8 of 80”,Name: “Table 1 of 1 on page 8 of 80”,Name: “Table 1 of 1 on page 8 of 80”,Name: “Table 1 of 1 on page 8 of 80”,Name: “Table 1 of 1 on page 8 of 80”
Table: 6,Table: 6,Table: 6,Table: 6,Table: 6,Table: 6,Table: 6,Table: 6,Table: 6,Table: 6,Table: 6,Table: 6,Table: 6,Table: 6,Table: 6,Table: 6,Table: 6,Table: 6,Table: 6,Table: 6,Table: 6
,,,,,,,,,,,,,,,,,,,,
,,,,,,,,,,,,,,EX EC UT I VE S UM M AR Y,EX EC UT I VE S UM M AR Y,EX EC UT I VE S UM M AR Y,EX EC UT I VE S UM M AR Y,EX EC UT I VE S UM M AR Y,EX EC UT I VE S UM M AR Y,
`,"Introduction – Skanska/Washington/BAM (SWB), a joint venture of Skanska USA, Inc. (Skanska),","Introduction – Skanska/Washington/BAM (SWB), a joint venture of Skanska USA, Inc. (Skanska),","Introduction – Skanska/Washington/BAM (SWB), a joint venture of Skanska USA, Inc. (Skanska),","Introduction – Skanska/Washington/BAM (SWB), a joint venture of Skanska USA, Inc. (Skanska),","Introduction – Skanska/Washington/BAM (SWB), a joint venture of Skanska USA, Inc. (Skanska),","Introduction – Skanska/Washington/BAM (SWB), a joint venture of Skanska USA, Inc. (Skanska),","Introduction – Skanska/Washington/BAM (SWB), a joint venture of Skanska USA, Inc. (Skanska),","Introduction – Skanska/Washington/BAM (SWB), a joint venture of Skanska USA, Inc. (Skanska),","Introduction – Skanska/Washington/BAM (SWB), a joint venture of Skanska USA, Inc. (Skanska),","Introduction – Skanska/Washington/BAM (SWB), a joint venture of Skanska USA, Inc. (Skanska),","Introduction – Skanska/Washington/BAM (SWB), a joint venture of Skanska USA, Inc. (Skanska),","Introduction – Skanska/Washington/BAM (SWB), a joint venture of Skanska USA, Inc. (Skanska),","Introduction – Skanska/Washington/BAM (SWB), a joint venture of Skanska USA, Inc. (Skanska),","Introduction – Skanska/Washington/BAM (SWB), a joint venture of Skanska USA, Inc. (Skanska),","Introduction – Skanska/Washington/BAM (SWB), a joint venture of Skanska USA, Inc. (Skanska),","Introduction – Skanska/Washington/BAM (SWB), a joint venture of Skanska USA, Inc. (Skanska),","Introduction – Skanska/Washington/BAM (SWB), a joint venture of Skanska USA, Inc. (Skanska),","Introduction – Skanska/Washington/BAM (SWB), a joint venture of Skanska USA, Inc. (Skanska),","Introduction – Skanska/Washington/BAM (SWB), a joint venture of Skanska USA, Inc. (Skanska),",
Washington,Washington,Group,International,International,International,(Washington),(Washington),(Washington),and,Royal,Royal,BAM,Group,Group,nv,(BAM),is,submitting,submitting,an
"unsolicited proposal for the development, design, construction, financing, operation and maintenance of","unsolicited proposal for the development, design, construction, financing, operation and maintenance of","unsolicited proposal for the development, design, construction, financing, operation and maintenance of","unsolicited proposal for the development, design, construction, financing, operation and maintenance of","unsolicited proposal for the development, design, construction, financing, operation and maintenance of","unsolicited proposal for the development, design, construction, financing, operation and maintenance of","unsolicited proposal for the development, design, construction, financing, operation and maintenance of","unsolicited proposal for the development, design, construction, financing, operation and maintenance of","unsolicited proposal for the development, design, construction, financing, operation and maintenance of","unsolicited proposal for the development, design, construction, financing, operation and maintenance of","unsolicited proposal for the development, design, construction, financing, operation and maintenance of","unsolicited proposal for the development, design, construction, financing, operation and maintenance of","unsolicited proposal for the development, design, construction, financing, operation and maintenance of","unsolicited proposal for the development, design, construction, financing, operation and maintenance of","unsolicited proposal for the development, design, construction, financing, operation and maintenance of","unsolicited proposal for the development, design, construction, financing, operation and maintenance of","unsolicited proposal for the development, design, construction, financing, operation and maintenance of","unsolicited proposal for the development, design, construction, financing, operation and maintenance of","unsolicited proposal for the development, design, construction, financing, operation and maintenance of","unsolicited proposal for the development, design, construction, financing, operation and maintenance of",
the Third Hampton Roads Crossing.,the Third Hampton Roads Crossing.,the Third Hampton Roads Crossing.,the Third Hampton Roads Crossing.,the Third Hampton Roads Crossing.,the Third Hampton Roads Crossing.,the Third Hampton Roads Crossing.,This conceptual proposal is submitted in accordance with the,This conceptual proposal is submitted in accordance with the,This conceptual proposal is submitted in accordance with the,This conceptual proposal is submitted in accordance with the,This conceptual proposal is submitted in accordance with the,This conceptual proposal is submitted in accordance with the,This conceptual proposal is submitted in accordance with the,This conceptual proposal is submitted in accordance with the,This conceptual proposal is submitted in accordance with the,This conceptual proposal is submitted in accordance with the,This conceptual proposal is submitted in accordance with the,This conceptual proposal is submitted in accordance with the,This conceptual proposal is submitted in accordance with the,
Virginia,Department,Department,Department,of,Transportation’s,Transportation’s,Transportation’s,(VDOT),(VDOT),implementing,implementing,implementing,guidelines,guidelines,guidelines,for,the,Virginia,Virginia,Public
Private Transportation Act of 1995.,Private Transportation Act of 1995.,Private Transportation Act of 1995.,Private Transportation Act of 1995.,Private Transportation Act of 1995.,Private Transportation Act of 1995.,Private Transportation Act of 1995.,This conceptual proposal is based upon the Major Investment Study,This conceptual proposal is based upon the Major Investment Study,This conceptual proposal is based upon the Major Investment Study,This conceptual proposal is based upon the Major Investment Study,This conceptual proposal is based upon the Major Investment Study,This conceptual proposal is based upon the Major Investment Study,This conceptual proposal is based upon the Major Investment Study,This conceptual proposal is based upon the Major Investment Study,This conceptual proposal is based upon the Major Investment Study,This conceptual proposal is based upon the Major Investment Study,This conceptual proposal is based upon the Major Investment Study,This conceptual proposal is based upon the Major Investment Study,This conceptual proposal is based upon the Major Investment Study,
"(MIS), the Environmental Impact Statement (EIS) and the 2001 Record of Decision.","(MIS), the Environmental Impact Statement (EIS) and the 2001 Record of Decision.","(MIS), the Environmental Impact Statement (EIS) and the 2001 Record of Decision.","(MIS), the Environmental Impact Statement (EIS) and the 2001 Record of Decision.","(MIS), the Environmental Impact Statement (EIS) and the 2001 Record of Decision.","(MIS), the Environmental Impact Statement (EIS) and the 2001 Record of Decision.","(MIS), the Environmental Impact Statement (EIS) and the 2001 Record of Decision.","(MIS), the Environmental Impact Statement (EIS) and the 2001 Record of Decision.","(MIS), the Environmental Impact Statement (EIS) and the 2001 Record of Decision.","(MIS), the Environmental Impact Statement (EIS) and the 2001 Record of Decision.","(MIS), the Environmental Impact Statement (EIS) and the 2001 Record of Decision.","(MIS), the Environmental Impact Statement (EIS) and the 2001 Record of Decision.","(MIS), the Environmental Impact Statement (EIS) and the 2001 Record of Decision.","(MIS), the Environmental Impact Statement (EIS) and the 2001 Record of Decision.","(MIS), the Environmental Impact Statement (EIS) and the 2001 Record of Decision.","(MIS), the Environmental Impact Statement (EIS) and the 2001 Record of Decision.","(MIS), the Environmental Impact Statement (EIS) and the 2001 Record of Decision.",The design team of,The design team of,The design team of,
"Parsons Brinckerhoff Quade & Douglas, Inc. and Jacobs Civil, Inc. (Jacobs) (formerly JE Sverdrup) will","Parsons Brinckerhoff Quade & Douglas, Inc. and Jacobs Civil, Inc. (Jacobs) (formerly JE Sverdrup) will","Parsons Brinckerhoff Quade & Douglas, Inc. and Jacobs Civil, Inc. (Jacobs) (formerly JE Sverdrup) will","Parsons Brinckerhoff Quade & Douglas, Inc. and Jacobs Civil, Inc. (Jacobs) (formerly JE Sverdrup) will","Parsons Brinckerhoff Quade & Douglas, Inc. and Jacobs Civil, Inc. (Jacobs) (formerly JE Sverdrup) will","Parsons Brinckerhoff Quade & Douglas, Inc. and Jacobs Civil, Inc. (Jacobs) (formerly JE Sverdrup) will","Parsons Brinckerhoff Quade & Douglas, Inc. and Jacobs Civil, Inc. (Jacobs) (formerly JE Sverdrup) will","Parsons Brinckerhoff Quade & Douglas, Inc. and Jacobs Civil, Inc. (Jacobs) (formerly JE Sverdrup) will","Parsons Brinckerhoff Quade & Douglas, Inc. and Jacobs Civil, Inc. (Jacobs) (formerly JE Sverdrup) will","Parsons Brinckerhoff Quade & Douglas, Inc. and Jacobs Civil, Inc. (Jacobs) (formerly JE Sverdrup) will","Parsons Brinckerhoff Quade & Douglas, Inc. and Jacobs Civil, Inc. (Jacobs) (formerly JE Sverdrup) will","Parsons Brinckerhoff Quade & Douglas, Inc. and Jacobs Civil, Inc. (Jacobs) (formerly JE Sverdrup) will","Parsons Brinckerhoff Quade & Douglas, Inc. and Jacobs Civil, Inc. (Jacobs) (formerly JE Sverdrup) will","Parsons Brinckerhoff Quade & Douglas, Inc. and Jacobs Civil, Inc. (Jacobs) (formerly JE Sverdrup) will","Parsons Brinckerhoff Quade & Douglas, Inc. and Jacobs Civil, Inc. (Jacobs) (formerly JE Sverdrup) will","Parsons Brinckerhoff Quade & Douglas, Inc. and Jacobs Civil, Inc. (Jacobs) (formerly JE Sverdrup) will","Parsons Brinckerhoff Quade & Douglas, Inc. and Jacobs Civil, Inc. (Jacobs) (formerly JE Sverdrup) will","Parsons Brinckerhoff Quade & Douglas, Inc. and Jacobs Civil, Inc. (Jacobs) (formerly JE Sverdrup) will","Parsons Brinckerhoff Quade & Douglas, Inc. and Jacobs Civil, Inc. (Jacobs) (formerly JE Sverdrup) will","Parsons Brinckerhoff Quade & Douglas, Inc. and Jacobs Civil, Inc. (Jacobs) (formerly JE Sverdrup) will",
serve as the engineer-of-record.,serve as the engineer-of-record.,serve as the engineer-of-record.,serve as the engineer-of-record.,serve as the engineer-of-record.,serve as the engineer-of-record.,The SWB Team members have been involved with the design and/or,The SWB Team members have been involved with the design and/or,The SWB Team members have been involved with the design and/or,The SWB Team members have been involved with the design and/or,The SWB Team members have been involved with the design and/or,The SWB Team members have been involved with the design and/or,The SWB Team members have been involved with the design and/or,The SWB Team members have been involved with the design and/or,The SWB Team members have been involved with the design and/or,The SWB Team members have been involved with the design and/or,The SWB Team members have been involved with the design and/or,The SWB Team members have been involved with the design and/or,The SWB Team members have been involved with the design and/or,The SWB Team members have been involved with the design and/or,
construction of all of the tunnels and bridge-tunnels in the Hampton Roads area.,construction of all of the tunnels and bridge-tunnels in the Hampton Roads area.,construction of all of the tunnels and bridge-tunnels in the Hampton Roads area.,construction of all of the tunnels and bridge-tunnels in the Hampton Roads area.,construction of all of the tunnels and bridge-tunnels in the Hampton Roads area.,construction of all of the tunnels and bridge-tunnels in the Hampton Roads area.,construction of all of the tunnels and bridge-tunnels in the Hampton Roads area.,construction of all of the tunnels and bridge-tunnels in the Hampton Roads area.,construction of all of the tunnels and bridge-tunnels in the Hampton Roads area.,construction of all of the tunnels and bridge-tunnels in the Hampton Roads area.,construction of all of the tunnels and bridge-tunnels in the Hampton Roads area.,construction of all of the tunnels and bridge-tunnels in the Hampton Roads area.,construction of all of the tunnels and bridge-tunnels in the Hampton Roads area.,construction of all of the tunnels and bridge-tunnels in the Hampton Roads area.,construction of all of the tunnels and bridge-tunnels in the Hampton Roads area.,construction of all of the tunnels and bridge-tunnels in the Hampton Roads area.,,,,,
`,Project Configuration - The Third Hampton Roads Crossing involves the construction of 13 miles,Project Configuration - The Third Hampton Roads Crossing involves the construction of 13 miles,Project Configuration - The Third Hampton Roads Crossing involves the construction of 13 miles,Project Configuration - The Third Hampton Roads Crossing involves the construction of 13 miles,Project Configuration - The Third Hampton Roads Crossing involves the construction of 13 miles,Project Configuration - The Third Hampton Roads Crossing involves the construction of 13 miles,Project Configuration - The Third Hampton Roads Crossing involves the construction of 13 miles,Project Configuration - The Third Hampton Roads Crossing involves the construction of 13 miles,Project Configuration - The Third Hampton Roads Crossing involves the construction of 13 miles,Project Configuration - The Third Hampton Roads Crossing involves the construction of 13 miles,Project Configuration - The Third Hampton Roads Crossing involves the construction of 13 miles,Project Configuration - The Third Hampton Roads Crossing involves the construction of 13 miles,Project Configuration - The Third Hampton Roads Crossing involves the construction of 13 miles,Project Configuration - The Third Hampton Roads Crossing involves the construction of 13 miles,Project Configuration - The Third Hampton Roads Crossing involves the construction of 13 miles,Project Configuration - The Third Hampton Roads Crossing involves the construction of 13 miles,Project Configuration - The Third Hampton Roads Crossing involves the construction of 13 miles,Project Configuration - The Third Hampton Roads Crossing involves the construction of 13 miles,Project Configuration - The Third Hampton Roads Crossing involves the construction of 13 miles,
of limited access expressway in addition to widening 15 miles of interstate highway. The project will,of limited access expressway in addition to widening 15 miles of interstate highway. The project will,of limited access expressway in addition to widening 15 miles of interstate highway. The project will,of limited access expressway in addition to widening 15 miles of interstate highway. The project will,of limited access expressway in addition to widening 15 miles of interstate highway. The project will,of limited access expressway in addition to widening 15 miles of interstate highway. The project will,of limited access expressway in addition to widening 15 miles of interstate highway. The project will,of limited access expressway in addition to widening 15 miles of interstate highway. The project will,of limited access expressway in addition to widening 15 miles of interstate highway. The project will,of limited access expressway in addition to widening 15 miles of interstate highway. The project will,of limited access expressway in addition to widening 15 miles of interstate highway. The project will,of limited access expressway in addition to widening 15 miles of interstate highway. The project will,of limited access expressway in addition to widening 15 miles of interstate highway. The project will,of limited access expressway in addition to widening 15 miles of interstate highway. The project will,of limited access expressway in addition to widening 15 miles of interstate highway. The project will,of limited access expressway in addition to widening 15 miles of interstate highway. The project will,of limited access expressway in addition to widening 15 miles of interstate highway. The project will,of limited access expressway in addition to widening 15 miles of interstate highway. The project will,of limited access expressway in addition to widening 15 miles of interstate highway. The project will,of limited access expressway in addition to widening 15 miles of interstate highway. The project will,
cross,Hampton,Roads,Roads,and,the,Elizabeth,Elizabeth,River,via trestles,via trestles,via trestles,and,two,new,tunnels,tunnels,to,provide,provide,greatly
enhanced mobility in the Hampton Roads area.,enhanced mobility in the Hampton Roads area.,enhanced mobility in the Hampton Roads area.,enhanced mobility in the Hampton Roads area.,enhanced mobility in the Hampton Roads area.,enhanced mobility in the Hampton Roads area.,enhanced mobility in the Hampton Roads area.,enhanced mobility in the Hampton Roads area.,enhanced mobility in the Hampton Roads area.,,,,,,,,,,,,
`,"Project Need - The Hampton Roads region is a major residential, commercial and tourist area in","Project Need - The Hampton Roads region is a major residential, commercial and tourist area in","Project Need - The Hampton Roads region is a major residential, commercial and tourist area in","Project Need - The Hampton Roads region is a major residential, commercial and tourist area in","Project Need - The Hampton Roads region is a major residential, commercial and tourist area in","Project Need - The Hampton Roads region is a major residential, commercial and tourist area in","Project Need - The Hampton Roads region is a major residential, commercial and tourist area in","Project Need - The Hampton Roads region is a major residential, commercial and tourist area in","Project Need - The Hampton Roads region is a major residential, commercial and tourist area in","Project Need - The Hampton Roads region is a major residential, commercial and tourist area in","Project Need - The Hampton Roads region is a major residential, commercial and tourist area in","Project Need - The Hampton Roads region is a major residential, commercial and tourist area in","Project Need - The Hampton Roads region is a major residential, commercial and tourist area in","Project Need - The Hampton Roads region is a major residential, commercial and tourist area in","Project Need - The Hampton Roads region is a major residential, commercial and tourist area in","Project Need - The Hampton Roads region is a major residential, commercial and tourist area in","Project Need - The Hampton Roads region is a major residential, commercial and tourist area in","Project Need - The Hampton Roads region is a major residential, commercial and tourist area in","Project Need - The Hampton Roads region is a major residential, commercial and tourist area in",
Virginia and home to many military installations.,Virginia and home to many military installations.,Virginia and home to many military installations.,Virginia and home to many military installations.,Virginia and home to many military installations.,Virginia and home to many military installations.,Virginia and home to many military installations.,Virginia and home to many military installations.,Virginia and home to many military installations.,Increasing traffic volumes have outstripped capacity.,Increasing traffic volumes have outstripped capacity.,Increasing traffic volumes have outstripped capacity.,Increasing traffic volumes have outstripped capacity.,Increasing traffic volumes have outstripped capacity.,Increasing traffic volumes have outstripped capacity.,Increasing traffic volumes have outstripped capacity.,Increasing traffic volumes have outstripped capacity.,Increasing traffic volumes have outstripped capacity.,Increasing traffic volumes have outstripped capacity.,Increasing traffic volumes have outstripped capacity.,
The MIS and EIS predict traffic levels will become so critical that by the time any solution is in place,The MIS and EIS predict traffic levels will become so critical that by the time any solution is in place,The MIS and EIS predict traffic levels will become so critical that by the time any solution is in place,The MIS and EIS predict traffic levels will become so critical that by the time any solution is in place,The MIS and EIS predict traffic levels will become so critical that by the time any solution is in place,The MIS and EIS predict traffic levels will become so critical that by the time any solution is in place,The MIS and EIS predict traffic levels will become so critical that by the time any solution is in place,The MIS and EIS predict traffic levels will become so critical that by the time any solution is in place,The MIS and EIS predict traffic levels will become so critical that by the time any solution is in place,The MIS and EIS predict traffic levels will become so critical that by the time any solution is in place,The MIS and EIS predict traffic levels will become so critical that by the time any solution is in place,The MIS and EIS predict traffic levels will become so critical that by the time any solution is in place,The MIS and EIS predict traffic levels will become so critical that by the time any solution is in place,The MIS and EIS predict traffic levels will become so critical that by the time any solution is in place,The MIS and EIS predict traffic levels will become so critical that by the time any solution is in place,The MIS and EIS predict traffic levels will become so critical that by the time any solution is in place,The MIS and EIS predict traffic levels will become so critical that by the time any solution is in place,The MIS and EIS predict traffic levels will become so critical that by the time any solution is in place,The MIS and EIS predict traffic levels will become so critical that by the time any solution is in place,The MIS and EIS predict traffic levels will become so critical that by the time any solution is in place,
the,regions,economy,economy,will,be,stifled,and,noxious,noxious,emissions,emissions,emissions,will,impair,the,health,health,of,individuals.,
Without,near-term,,"relief,","relief,",the,quality,of,life,and,the,region’s,region’s,economy,economy,will,decline.,decline.,Several,Several,recent
occurrences of major gridlock are just another indication that the Third Hampton Roads Crossing is,occurrences of major gridlock are just another indication that the Third Hampton Roads Crossing is,occurrences of major gridlock are just another indication that the Third Hampton Roads Crossing is,occurrences of major gridlock are just another indication that the Third Hampton Roads Crossing is,occurrences of major gridlock are just another indication that the Third Hampton Roads Crossing is,occurrences of major gridlock are just another indication that the Third Hampton Roads Crossing is,occurrences of major gridlock are just another indication that the Third Hampton Roads Crossing is,occurrences of major gridlock are just another indication that the Third Hampton Roads Crossing is,occurrences of major gridlock are just another indication that the Third Hampton Roads Crossing is,occurrences of major gridlock are just another indication that the Third Hampton Roads Crossing is,occurrences of major gridlock are just another indication that the Third Hampton Roads Crossing is,occurrences of major gridlock are just another indication that the Third Hampton Roads Crossing is,occurrences of major gridlock are just another indication that the Third Hampton Roads Crossing is,occurrences of major gridlock are just another indication that the Third Hampton Roads Crossing is,occurrences of major gridlock are just another indication that the Third Hampton Roads Crossing is,occurrences of major gridlock are just another indication that the Third Hampton Roads Crossing is,occurrences of major gridlock are just another indication that the Third Hampton Roads Crossing is,occurrences of major gridlock are just another indication that the Third Hampton Roads Crossing is,occurrences of major gridlock are just another indication that the Third Hampton Roads Crossing is,occurrences of major gridlock are just another indication that the Third Hampton Roads Crossing is,
needed earlier rather than later.,needed earlier rather than later.,needed earlier rather than later.,needed earlier rather than later.,needed earlier rather than later.,needed earlier rather than later.,,,,,,,,,,,,,,,
`,Consistency,with,with,Concept,Concept,-,The,EIS,provides,provides,an,estimate,estimate,of,$4.4,billion,to,construct,construct,the
